{
  "schema": "org.mura.flash.target-record/v1",
  "id": "samsung-galaxy-xr-sm-i610",
  "displayName": "Samsung Galaxy XR",
  "vendor": "Samsung",
  "models": [
    "SM-I610"
  ],
  "codenames": [],
  "enabled": false,
  "hardwareQualification": "unqualified",
  "sourceBehavior": {
    "unlockState": "reported",
    "installState": "procedure-available",
    "summary": "The disabled simulation preserves launch unlock reporting, a zero-write AYKE rollback-unverified stop, independent post-reboot Download lock-state verification for direct AYIA unlock, and zero-write U2/unknown refusals. No live Samsung write is qualified."
  },
  "muraPolicy": {
    "writesAllowed": false,
    "reason": "AYIA package digest, exact package/member filenames, Download entry and host transport, complete protected-state backups, AYKE rollback proof, and stock restore remain unresolved evidence gates."
  },
  "procedureAvailability": {
    "kind": "available",
    "procedureIds": [
      "samsung-galaxy-xr-ayke-to-ayia-rollback-unlock"
    ]
  },
  "sourceCitations": [
    {
      "kind": "repository",
      "path": "evidence/samsung/official-build-ledger.json",
      "lineStart": 12,
      "lineEnd": 42
    },
    {
      "kind": "repository",
      "path": "evidence/samsung/ayia-community-report.json",
      "lineStart": 14,
      "lineEnd": 24
    },
    {
      "kind": "repository",
      "path": "evidence/samsung/launch-unlock-media.json",
      "lineStart": 13,
      "lineEnd": 40
    },
    {
      "kind": "repository",
      "path": "evidence/samsung/wall-of-shame-claims.json",
      "lineStart": 16,
      "lineEnd": 35
    },
    {
      "kind": "pinned-external",
      "uri": "https://github.com/mura-os/mura/blob/48699362710177854ebeedb7c25f30277296d401/docs/research/72-xr-unlock-and-flash-targets.md",
      "commit": "48699362710177854ebeedb7c25f30277296d401",
      "path": "docs/research/72-xr-unlock-and-flash-targets.md",
      "lineStart": 117,
      "lineEnd": 201
    }
  ]
}
